{
  "connector_id": "conn-github-001",
  "connector_type": "github",
  "provider": "github",
  "mission_id": "m-001",
  "project_uuid": "aaaaaaaa-bbbb-cccc-dddd-eeeeeeeeeeee",
  "actor_id": "system-reconnector",
  "actor_type": "system",
  "endpoint_url": "https://api.github.com",
  "recorded_at": "2026-02-27T12:20:00+00:00",
  "previous_state": "degraded",
  "reconnect_strategy": "automatic"
}
